{
  "schema_version": "1.0.0",
  "ref": "lcnd-secret://lcsp/egress-cn/provider-node",
  "owner": "LCSP",
  "consumer": "lcnd-egress-cn",
  "material_class": "engine_runtime_config",
  "rotation_policy": "owner_managed",
  "allowed_outputs": ["presence_status", "redacted_digest"],
  "forbidden_outputs": ["value", "url", "password", "token", "subscription", "private_key"]
}
